{
  "$schema": "https://json-schema.org/draft/2020-12/schema",
  "$id": "https://mncs.dev/schema/mncds/0.1/mncds-development-record.schema.json",
  "title": "MNCDS 0.1 development record",
  "type": "object",
  "additionalProperties": false,
  "required": [
    "schema_version",
    "mncds_version",
    "record_id",
    "profile",
    "epoch_id",
    "created_at",
    "charter",
    "roles",
    "generator",
    "partitions",
    "evaluators",
    "candidates",
    "selection",
    "reproducibility",
    "extensions"
  ],
  "properties": {
    "schema_version": {"const": "0.1"},
    "mncds_version": {"const": "0.1-draft"},
    "record_id": {"$ref": "#/$defs/id"},
    "profile": {"enum": ["MNCDS-D1", "MNCDS-D2", "MNCDS-D3", "MNCDS-D4"]},
    "epoch_id": {"$ref": "#/$defs/id"},
    "supersedes_record_id": {"type": ["string", "null"], "pattern": "^[A-Za-z0-9][A-Za-z0-9._:-]{0,127}$"},
    "created_at": {"type": "string", "format": "date-time"},
    "charter": {"$ref": "#/$defs/charter"},
    "roles": {
      "type": "array",
      "minItems": 6,
      "items": {"$ref": "#/$defs/role"}
    },
    "generator": {"$ref": "#/$defs/generator"},
    "partitions": {"$ref": "#/$defs/partitions"},
    "evaluators": {
      "type": "array",
      "minItems": 1,
      "items": {"$ref": "#/$defs/evaluator"}
    },
    "candidates": {
      "type": "array",
      "minItems": 1,
      "items": {"$ref": "#/$defs/candidate"}
    },
    "selection": {"$ref": "#/$defs/selection"},
    "reproducibility": {"$ref": "#/$defs/reproducibility"},
    "mncs_binding": {
      "oneOf": [
        {"type": "null"},
        {"$ref": "#/$defs/mncsBinding"}
      ]
    },
    "release_controls": {
      "oneOf": [
        {"type": "null"},
        {"$ref": "#/$defs/releaseControls"}
      ]
    },
    "extensions": {"$ref": "#/$defs/extensions"}
  },
  "$defs": {
    "id": {"type": "string", "pattern": "^[A-Za-z0-9][A-Za-z0-9._:-]{0,127}$"},
    "status": {"enum": ["PASS", "FAIL", "UNKNOWN"]},
    "extensions": {
      "type": "object",
      "propertyNames": {"pattern": "^[a-z][a-z0-9.-]*:[A-Za-z0-9][A-Za-z0-9._-]*$"},
      "additionalProperties": true
    },
    "charter": {
      "type": "object",
      "additionalProperties": false,
      "required": [
        "problem_statement",
        "intended_use",
        "contract_id",
        "baseline_id",
        "environment_id",
        "threat_model_id",
        "objective",
        "selection_policy_id",
        "planned_mncs_level",
        "hard_rejection_gates"
      ],
      "properties": {
        "problem_statement": {"type": "string", "minLength": 1},
        "intended_use": {"type": "string", "minLength": 1},
        "contract_id": {"$ref": "#/$defs/id"},
        "baseline_id": {"$ref": "#/$defs/id"},
        "environment_id": {"$ref": "#/$defs/id"},
        "threat_model_id": {"$ref": "#/$defs/id"},
        "objective": {
          "type": "object",
          "additionalProperties": false,
          "required": ["objective_id", "metric", "unit", "direction", "minimum_useful_benefit"],
          "properties": {
            "objective_id": {"$ref": "#/$defs/id"},
            "metric": {"type": "string", "minLength": 1},
            "unit": {"type": "string", "minLength": 1},
            "direction": {"enum": ["minimize", "maximize"]},
            "minimum_useful_benefit": {"type": "number"}
          }
        },
        "selection_policy_id": {"$ref": "#/$defs/id"},
        "planned_mncs_level": {
          "type": ["string", "null"],
          "enum": [null, "MNCS-L1", "MNCS-L2", "MNCS-L3", "MNCS-L4", "MNCS-L5"]
        },
        "hard_rejection_gates": {
          "type": "array",
          "minItems": 1,
          "uniqueItems": true,
          "items": {"$ref": "#/$defs/id"}
        }
      }
    },
    "role": {
      "type": "object",
      "additionalProperties": false,
      "required": ["role", "authority_id", "executable_id"],
      "properties": {
        "role": {
          "enum": [
            "contract_authority",
            "generator_authority",
            "evaluator_authority",
            "selection_authority",
            "release_authority",
            "independent_reviewer"
          ]
        },
        "authority_id": {"$ref": "#/$defs/id"},
        "executable_id": {"type": ["string", "null"], "pattern": "^[A-Za-z0-9][A-Za-z0-9._:-]{0,127}$"}
      }
    },
    "generator": {
      "type": "object",
      "additionalProperties": false,
      "required": ["generator_id", "configuration_id", "authority_id", "executable_id", "permissions", "resource_limits"],
      "properties": {
        "generator_id": {"$ref": "#/$defs/id"},
        "configuration_id": {"$ref": "#/$defs/id"},
        "authority_id": {"$ref": "#/$defs/id"},
        "executable_id": {"$ref": "#/$defs/id"},
        "permissions": {
          "type": "object",
          "additionalProperties": false,
          "required": [
            "modify_contract",
            "modify_baseline",
            "modify_evaluators",
            "modify_selection_policy",
            "modify_thresholds",
            "access_protected_holdout",
            "network_access"
          ],
          "properties": {
            "modify_contract": {"type": "boolean"},
            "modify_baseline": {"type": "boolean"},
            "modify_evaluators": {"type": "boolean"},
            "modify_selection_policy": {"type": "boolean"},
            "modify_thresholds": {"type": "boolean"},
            "access_protected_holdout": {"type": "boolean"},
            "network_access": {"type": "boolean"}
          }
        },
        "resource_limits": {
          "type": "object",
          "additionalProperties": false,
          "required": ["max_candidates", "max_wall_seconds"],
          "properties": {
            "max_candidates": {"type": "integer", "minimum": 1},
            "max_wall_seconds": {"type": "number", "exclusiveMinimum": 0}
          }
        }
      }
    },
    "partitions": {
      "type": "object",
      "additionalProperties": false,
      "required": ["development_id", "selection_id", "holdout_id", "holdout_contaminated"],
      "properties": {
        "development_id": {"$ref": "#/$defs/id"},
        "selection_id": {"$ref": "#/$defs/id"},
        "holdout_id": {"type": ["string", "null"], "pattern": "^[A-Za-z0-9][A-Za-z0-9._:-]{0,127}$"},
        "holdout_contaminated": {"type": "boolean"}
      }
    },
    "evaluator": {
      "type": "object",
      "additionalProperties": false,
      "required": ["evaluator_id", "purpose", "authority_id", "executable_id", "configuration_id", "independent", "regression_corpus_id"],
      "properties": {
        "evaluator_id": {"$ref": "#/$defs/id"},
        "purpose": {"enum": ["development", "selection", "holdout", "independent"]},
        "authority_id": {"$ref": "#/$defs/id"},
        "executable_id": {"$ref": "#/$defs/id"},
        "configuration_id": {"$ref": "#/$defs/id"},
        "independent": {"type": "boolean"},
        "regression_corpus_id": {"type": ["string", "null"], "pattern": "^[A-Za-z0-9][A-Za-z0-9._:-]{0,127}$"}
      }
    },
    "candidate": {
      "type": "object",
      "additionalProperties": false,
      "required": [
        "candidate_id",
        "parent_ids",
        "generator_id",
        "build_status",
        "disposition",
        "objective_value",
        "evaluator_results"
      ],
      "properties": {
        "candidate_id": {"$ref": "#/$defs/id"},
        "parent_ids": {
          "type": "array",
          "uniqueItems": true,
          "items": {"$ref": "#/$defs/id"}
        },
        "generator_id": {"$ref": "#/$defs/id"},
        "build_status": {"$ref": "#/$defs/status"},
        "disposition": {"enum": ["rejected", "retained", "promoted", "selected"]},
        "objective_value": {"type": ["number", "null"]},
        "evaluator_results": {
          "type": "array",
          "minItems": 1,
          "items": {
            "type": "object",
            "additionalProperties": false,
            "required": ["evaluator_id", "gate_id", "required", "status", "evidence_id"],
            "properties": {
              "evaluator_id": {"$ref": "#/$defs/id"},
              "gate_id": {"$ref": "#/$defs/id"},
              "required": {"type": "boolean"},
              "status": {"$ref": "#/$defs/status"},
              "evidence_id": {"$ref": "#/$defs/id"}
            }
          }
        }
      }
    },
    "selection": {
      "type": "object",
      "additionalProperties": false,
      "required": [
        "policy_id",
        "selected_candidate_id",
        "rule_recorded_before_holdout",
        "unknown_policy",
        "minimum_useful_benefit_met",
        "rationale",
        "human_review"
      ],
      "properties": {
        "policy_id": {"$ref": "#/$defs/id"},
        "selected_candidate_id": {"$ref": "#/$defs/id"},
        "rule_recorded_before_holdout": {"type": "boolean"},
        "unknown_policy": {"enum": ["reject", "human_review"]},
        "minimum_useful_benefit_met": {"type": "boolean"},
        "rationale": {"type": "string", "minLength": 1},
        "human_review": {
          "oneOf": [
            {"type": "null"},
            {
              "type": "object",
              "additionalProperties": false,
              "required": ["reviewer_id", "decision", "rationale"],
              "properties": {
                "reviewer_id": {"$ref": "#/$defs/id"},
                "decision": {"enum": ["accept_with_unknown", "reject"]},
                "rationale": {"type": "string", "minLength": 1}
              }
            }
          ]
        }
      }
    },
    "reproducibility": {
      "type": "object",
      "additionalProperties": false,
      "required": ["class", "seeds_preserved", "protocol", "measurement_repetitions"],
      "properties": {
        "class": {"enum": ["EXACT", "SEEDED", "STATISTICAL", "DISTRIBUTIONAL", "NONE"]},
        "seeds_preserved": {"type": "boolean"},
        "protocol": {"type": "string", "minLength": 1},
        "measurement_repetitions": {"type": "integer", "minimum": 1}
      }
    },
    "mncsBinding": {
      "type": "object",
      "additionalProperties": false,
      "required": ["manifest_or_package_id", "candidate_id", "contract_id", "environment_id"],
      "properties": {
        "manifest_or_package_id": {"$ref": "#/$defs/id"},
        "candidate_id": {"$ref": "#/$defs/id"},
        "contract_id": {"$ref": "#/$defs/id"},
        "environment_id": {"$ref": "#/$defs/id"}
      }
    },
    "releaseControls": {
      "type": "object",
      "additionalProperties": false,
      "required": [
        "release_artifact_id",
        "rollback_artifact_id",
        "rollback_test_status",
        "monitoring_thresholds",
        "regeneration_drill",
        "retirement_triggers"
      ],
      "properties": {
        "release_artifact_id": {"$ref": "#/$defs/id"},
        "rollback_artifact_id": {"$ref": "#/$defs/id"},
        "rollback_test_status": {"$ref": "#/$defs/status"},
        "monitoring_thresholds": {
          "type": "array",
          "minItems": 1,
          "items": {"type": "string", "minLength": 1}
        },
        "regeneration_drill": {
          "type": "object",
          "additionalProperties": false,
          "required": ["performed_at", "status", "evidence_id"],
          "properties": {
            "performed_at": {"type": "string", "format": "date-time"},
            "status": {"$ref": "#/$defs/status"},
            "evidence_id": {"$ref": "#/$defs/id"}
          }
        },
        "retirement_triggers": {
          "type": "array",
          "minItems": 1,
          "items": {"type": "string", "minLength": 1}
        }
      }
    }
  }
}
