{
  "candidates": [
    {
      "build_status": "PASS",
      "candidate_id": "candidate-readable-reference",
      "disposition": "rejected",
      "evaluator_results": [
        {
          "evaluator_id": "evaluator-edgestream-v1",
          "evidence_id": "gate-behavioral",
          "gate_id": "behavioral",
          "required": true,
          "status": "PASS"
        }
      ],
      "generator_id": "generator-edgestream-v1",
      "objective_value": 57775029.73687879,
      "parent_ids": []
    },
    {
      "build_status": "PASS",
      "candidate_id": "candidate-generated-crc-table",
      "disposition": "selected",
      "evaluator_results": [
        {
          "evaluator_id": "evaluator-edgestream-v1",
          "evidence_id": "gate-behavioral",
          "gate_id": "behavioral",
          "required": true,
          "status": "PASS"
        },
        {
          "evaluator_id": "evaluator-edgestream-v1",
          "evidence_id": "gate-safety",
          "gate_id": "safety",
          "required": true,
          "status": "PASS"
        },
        {
          "evaluator_id": "evaluator-edgestream-v1",
          "evidence_id": "gate-resource-bounds",
          "gate_id": "resource_bounds",
          "required": true,
          "status": "PASS"
        },
        {
          "evaluator_id": "evaluator-edgestream-selection-v1",
          "evidence_id": "performance-throughput",
          "gate_id": "benefit_threshold",
          "required": true,
          "status": "PASS"
        }
      ],
      "generator_id": "generator-edgestream-v1",
      "objective_value": 96149681.41409333,
      "parent_ids": [
        "candidate-readable-reference"
      ]
    }
  ],
  "charter": {
    "baseline_id": "edgestream-reference-c11-v1",
    "contract_id": "mncs.edgestream.telemetry.v1",
    "environment_id": "identity-environment",
    "hard_rejection_gates": [
      "behavioral",
      "compiler_matrix",
      "safety",
      "resource_bounds",
      "mutation",
      "structural"
    ],
    "intended_use": "A realistic MNCS development case study for stateful machine-native implementation acceptance.",
    "objective": {
      "direction": "maximize",
      "metric": "telemetry throughput",
      "minimum_useful_benefit": 0.15,
      "objective_id": "edgestream-throughput-v1",
      "unit": "bytes_per_second"
    },
    "planned_mncs_level": "MNCS-L4",
    "problem_statement": "Produce a faster contract-equivalent fault-tolerant telemetry processor without weakening correctness, safety, resource, or recovery behavior.",
    "selection_policy_id": "edgestream-selection-policy-v1",
    "threat_model_id": "edgestream-threat-model-v1"
  },
  "created_at": "2026-07-26T23:00:00Z",
  "epoch_id": "edgestream-epoch-1",
  "evaluators": [
    {
      "authority_id": "authority-edgestream-evaluator",
      "configuration_id": "evaluator-config-v1",
      "evaluator_id": "evaluator-edgestream-v1",
      "executable_id": "evaluator-run-study-v1",
      "independent": false,
      "purpose": "development",
      "regression_corpus_id": "edgestream-evaluator-regression-v1"
    },
    {
      "authority_id": "authority-edgestream-selection",
      "configuration_id": "selection-config-v1",
      "evaluator_id": "evaluator-edgestream-selection-v1",
      "executable_id": "selection-policy-v1",
      "independent": false,
      "purpose": "selection",
      "regression_corpus_id": "edgestream-evaluator-regression-v1"
    }
  ],
  "extensions": {
    "mncds.dev:evaluation-epoch": "edgestream-evaluation-epoch-2",
    "mncds.dev:harness-regression-status": "PASS",
    "mncs.dev:study-status": "development"
  },
  "generator": {
    "authority_id": "authority-edgestream-generator",
    "configuration_id": "generator-edgestream-crc-table-v1",
    "executable_id": "generator-generate-candidate-v1",
    "generator_id": "generator-edgestream-v1",
    "permissions": {
      "access_protected_holdout": false,
      "modify_baseline": false,
      "modify_contract": false,
      "modify_evaluators": false,
      "modify_selection_policy": false,
      "modify_thresholds": false,
      "network_access": false
    },
    "resource_limits": {
      "max_candidates": 2,
      "max_wall_seconds": 3600
    }
  },
  "mncds_version": "0.1-draft",
  "mncs_binding": {
    "candidate_id": "candidate-generated-crc-table",
    "contract_id": "mncs.edgestream.telemetry.v1",
    "environment_id": "identity-environment",
    "manifest_or_package_id": "edgestream-manifest-v1"
  },
  "partitions": {
    "development_id": "edgestream-development-corpus-v1",
    "holdout_contaminated": false,
    "holdout_id": null,
    "selection_id": "edgestream-selection-corpus-v1"
  },
  "profile": "MNCDS-D2",
  "record_id": "edgestream-epoch-1-d2",
  "release_controls": null,
  "reproducibility": {
    "class": "EXACT",
    "measurement_repetitions": 7,
    "protocol": "Regenerate the candidate twice, generate deterministic workloads, rebuild with the declared compiler matrix, and repeat every paired measurement seven times.",
    "seeds_preserved": true
  },
  "roles": [
    {
      "authority_id": "authority-mncs-maintainer",
      "executable_id": null,
      "role": "contract_authority"
    },
    {
      "authority_id": "authority-edgestream-generator",
      "executable_id": "generator-generate-candidate-v1",
      "role": "generator_authority"
    },
    {
      "authority_id": "authority-edgestream-evaluator",
      "executable_id": "evaluator-run-study-v1",
      "role": "evaluator_authority"
    },
    {
      "authority_id": "authority-edgestream-selection",
      "executable_id": "selection-policy-v1",
      "role": "selection_authority"
    },
    {
      "authority_id": "authority-mncs-maintainer",
      "executable_id": null,
      "role": "release_authority"
    },
    {
      "authority_id": "authority-unassigned-independent-review",
      "executable_id": null,
      "role": "independent_reviewer"
    }
  ],
  "schema_version": "0.1",
  "selection": {
    "human_review": null,
    "minimum_useful_benefit_met": true,
    "policy_id": "edgestream-selection-policy-v1",
    "rationale": "The generated candidate passed every hard gate and exceeded the predeclared throughput threshold. No protected holdout or independent-review claim is made.",
    "rule_recorded_before_holdout": true,
    "selected_candidate_id": "candidate-generated-crc-table",
    "unknown_policy": "reject"
  },
  "supersedes_record_id": null
}
